BookId,Author,Title,Category,Language,Words,Added
graphic/ahead9804400.mobi,Shane Johnson,Door peace lead,graphic,fr,814704,2020-11-08
graphic/all4415352.mobi,Bradley Scott,Third trouble under society since,graphic,en,616262,2016-07-30
graphic/ask6791635.mobi,Jennifer Wheeler,Water build policy dog prepare follow,graphic,fr,168526,2024-05-13
graphic/choose5788644.mobi,Stephanie Brooks,Middle station personal what pattern there,graphic,fr,703922,2021-03-17
graphic/policy7267712.mobi,Melanie Robertson,Everything than ever idea,graphic,en,339482,2021-07-20
graphic/send8796015.mobi,Eric James,Financial various daughter early her weight exist our,graphic,fr,729361,2023-02-03
graphic/sister2978823.mobi,Emma Jones,Other deep discover strategy before decide miss,graphic,fr,656569,2019-09-14
graphic/television6245683.mobi,Anne Sanchez,Sense decide catch those these let family,graphic,fr,989917,2018-07-19
graphic/voice8625711.mobi,Kimberly Stephens,Pretty maybe billion,graphic,fr,413008,2015-11-21
graphic/way8910235.mobi,Tammy Garcia,Color plant sign if,graphic,fr,296357,2019-07-29
graphic/who3791610.mobi,Tina Schmitt,Recognize tough several set,graphic,fr,51327,2022-12-16
graphic/wide8727768.mobi,Jennifer Reid,Customer score behavior,graphic,en,984301,2019-10-26
non-fiction/anything1773618.mobi,Mr. Paul Flores,But some common recent thought ask,non-fiction,en,121920,2022-08-28
non-fiction/argue3031162.mobi,Jo Thomas,Life himself quite citizen,non-fiction,en,339450,2021-08-09
non-fiction/billion5665911.mobi,Cynthia Walton,Bed idea window evidence want,non-fiction,en,178901,2024-08-09
non-fiction/cell814391.mobi,Kyle Saunders,Note season which single,non-fiction,en,410503,2015-08-20
non-fiction/heart3462878.mobi,Troy Adkins,Both commercial present finally single up,non-fiction,fr,754897,2019-06-19
non-fiction/in6672894.mobi,Deborah Harris,Sense third clearly worker,non-fiction,en,87073,2023-04-20
non-fiction/institution202827.mobi,Cheryl Green,Teach form case respond western break four,non-fiction,en,594834,2016-08-24
non-fiction/join9759990.mobi,Jeffery Chambers,Meeting message against without word often,non-fiction,fr,419450,2020-01-19
non-fiction/maintain5982550.mobi,Darrell Anderson,Prove benefit name firm risk speech compare,non-fiction,en,943437,2017-01-29
non-fiction/majority6839539.mobi,Jacob Ross,Check ask professional information by theory,non-fiction,fr,74464,2024-06-02
non-fiction/mission1256707.mobi,Isaac Walker,Newspaper evening suffer pretty in might result,non-fiction,fr,310473,2023-10-07
non-fiction/mother7758247.mobi,Adam Garcia,Design box sport nothing write direction,non-fiction,fr,234002,2015-03-23
non-fiction/next5543702.mobi,Bridget Fisher,Through beautiful thing participant account then,non-fiction,fr,745577,2023-07-28
non-fiction/painting8684794.mobi,Maria Esparza,Recognize report arm experience thousand my,non-fiction,fr,548573,2016-07-20
non-fiction/parent301993.mobi,Jill Williams MD,Cost risk others,non-fiction,en,862338,2022-04-13
non-fiction/pay5891953.mobi,Chris Jones,Well culture we,non-fiction,en,549079,2016-05-10
non-fiction/personal961421.mobi,Kyle Kirk,Life until business nearly,non-fiction,en,573566,2021-05-03
non-fiction/shoulder9055518.mobi,Ronald Goodwin,General federal machine suffer window,non-fiction,en,210952,2016-10-16
non-fiction/similar9099672.mobi,Eric Reeves,Fight see program which kitchen,non-fiction,en,693827,2021-07-08
non-fiction/small4883182.mobi,Emily Baxter,Example too can happy several hand enter,non-fiction,fr,295877,2018-03-15
non-fiction/song9705732.mobi,Andrea Jenkins,Yes within type side nor society,non-fiction,fr,120766,2016-01-02
non-fiction/space122655.mobi,Kenneth Owen,So plant hospital receive former,non-fiction,en,666389,2016-06-14
non-fiction/sure6361849.mobi,Monica Sanchez,Tv decision marriage yet party establish voice one,non-fiction,fr,804799,2015-05-26
non-fiction/system3491939.mobi,Kevin Guerrero,Stay major official artist become yes around especially,non-fiction,fr,819938,2017-11-30
non-fiction/tree4200009.mobi,Barbara Medina,Find debate role special surface fine,non-fiction,fr,554536,2017-11-15
non-fiction/vote5605990.mobi,Harry Burnett,Option million important into six,non-fiction,en,286814,2019-01-27
novels/base4499783.mobi,Kevin Roy,Government drop other,novels,en,322859,2017-12-30
novels/bring9410253.mobi,Whitney Haas,Who include total rise travel,novels,en,114287,2015-01-05
novels/contain4575204.mobi,Kimberly Hayes,Start senior turn physical behavior all,novels,en,899880,2018-10-11
novels/debate236425.mobi,Sharon Mahoney,Now positive every,novels,fr,647275,2022-11-15
novels/feel3359831.mobi,David Lopez,Key fine something alone just,novels,en,693683,2018-01-17
novels/film8272384.mobi,Isaac Zavala,Change first past dog seven all over,novels,fr,739782,2018-07-16
novels/list9783288.mobi,Ronald Boone,Control worry successful,novels,fr,674860,2023-10-08
novels/major4068294.mobi,Gregory Harvey,Who of cut understand figure,novels,en,426802,2020-11-10
novels/many8005217.mobi,Earl Roach,Friend bill our nearly nor young,novels,en,858780,2021-11-26
novels/newspaper7336018.mobi,Gregory Clark,Under expert huge join hold strategy,novels,fr,397394,2021-11-18
novels/only8865006.mobi,Anita Parrish,Garden cultural fear baby large,novels,fr,564096,2020-03-10
novels/significant1915003.mobi,Derrick Duncan,Expert house stage,novels,en,305663,2023-02-08
novels/sing191361.mobi,Joseph Johnson,This society Mrs national,novels,en,311992,2021-08-05
novels/spend9796486.mobi,Allison Ellis,Put expect these appear,novels,fr,495661,2014-09-22
novels/term4286869.mobi,Wyatt Jackson,House parent them politics language financial art,novels,en,505957,2017-09-20
novels/trouble1079227.mobi,Caitlyn Baldwin,President lawyer foreign fund however,novels,en,500795,2018-04-07
novels/watch864686.mobi,Julia Garcia,Without group mother carry commercial field career war,novels,fr,207538,2018-10-30
short-stories/attack4571100.mobi,Thomas Bowers,Finally box policy never account machine protect establish,short-stories,fr,82957,2023-12-01
short-stories/capital2769390.mobi,Sandra Young,Career attorney left international participant speech,short-stories,en,175684,2021-02-07
short-stories/effort8733907.mobi,Jeffrey Mayer,Do responsibility education test all population despite,short-stories,en,179619,2018-09-10
short-stories/financial4548176.mobi,Raymond Garcia,Whole talk know fight visit star,short-stories,fr,961939,2015-08-23
short-stories/give7851625.mobi,Kelly Mckenzie,Learn entire course shoulder,short-stories,fr,117102,2016-11-16
short-stories/however1694733.mobi,Robert Mcdaniel,Pass college particularly law close,short-stories,en,172859,2018-07-16
short-stories/media4320674.mobi,Michael Hawkins,Physical thing travel environmental,short-stories,fr,171017,2022-07-16
short-stories/mention7351066.mobi,Lydia Walter,Raise may field alone exist true cut,short-stories,en,907349,2015-05-02
short-stories/out11783.mobi,Tony Black,Your white word official agency,short-stories,en,327637,2022-01-04
short-stories/peace1174010.mobi,Lisa Kane,Cover letter next,short-stories,en,533449,2019-07-02
short-stories/present8752679.mobi,Janet Sosa,Drug art natural heavy,short-stories,fr,809937,2022-07-28
short-stories/show6436662.mobi,Phillip Jones,Key development financial wear continue stay,short-stories,fr,457742,2022-05-16
short-stories/traditional6862967.mobi,Corey Griffin,Year discussion visit technology much prove cell,short-stories,en,616283,2024-01-30
short-stories/trial3193055.mobi,Stephen Wright,Skin yes brother early research court strong,short-stories,fr,371649,2019-12-11
short-stories/woman3557736.mobi,Amy Clayton,Child successful realize popular responsibility health stage,short-stories,en,940430,2023-12-16
short-stories/writer4949933.mobi,Manuel Brewer,Scene week her treat,short-stories,en,976769,2020-09-22
